IsToxic,IsToxic,IsToxic,IsToxic,IsAbusive,IsThreat,IsProvocative,IsObscene,IsHatespeech,IsRacist,IsNationalist,IsSexist,IsHomophobic,IsReligiousHate,IsRadicalism
Ugg2KwwX0V8-aXgCoAEC,04kJtp6pVXI,"If only people would just take a step back and not make this case about them, because it wasn't about anyone except the two people in that situation.  To lump yourself into this mess and take matters into your own hands makes these kinds of protests selfish and without rational thought and investigation.  The guy in this video is heavily emotional and hyped up and wants to be heard, and when he gets heard he just presses more and more.  He was never out to have a reasonable discussion.  Kudos to the Smerconish for keeping level the whole time and letting Masri make himself out to be a fool.  How dare he and those that tore that city down in protest make this about themselves and to dishonor the entire incident with their own hate.  By the way, since when did police brutality become an epidemic?  I wish everyone would just stop pretending like they were there and they knew EXACTLY what was going on, because there's no measurable amount of people that honestly witnessed this incident, so none of us have a clue on which way this whole issue should have swung.  The grand jury were the most informed, we have to trust the majority rule was the right course of action and let it be.  Also, thank you to the 99.999% of police officers in America that actually serve & protect, even if you're a bit of a jerk when you pull me over, I respect your job and know that someone has to do it and that many people are going to pout about being held accountable to their actions.  People hate police until they need an officer or two around in an emergency.",FALSE,FALSE,FALSE,FALSE,FALSE,FALSE,FALSE,FALSE,FALSE,FALSE,FALSE,FALSE
Ugg2s5AzSPioEXgCoAEC,04kJtp6pVXI,Law enforcement is not trained to shoot to apprehend.  They are trained to shoot to kill.  And I thank Wilson for killing that punk bitch.,TRUE,TRUE,FALSE,FALSE,FALSE,FALSE,FALSE,FALSE,FALSE,FALSE,FALSE,FALSE
Ugg3dWTOxryFfHgCoAEC,04kJtp6pVXI,"
Dont you reckon them 'black lives matter' banners being held by white cunts is  kinda patronizing and ironically racist. could they have not come up with somethin better.. or is it just what white folks do to give them selves pride. 'ooo look at me im being nice for the black people' why does it always have to be about race actually the whole world is pussyfootin around for fear of being racist. its fuckin daft man.",TRUE,TRUE,FALSE,FALSE,TRUE,FALSE,FALSE,FALSE,FALSE,FALSE,FALSE,FALSE
Ugg7Gd006w1MPngCoAEC,04kJtp6pVXI,"There are a very large number of people who do not like police officers. They are called Criminals and its the reason we have police officers. The fact that Criminals do not like police officers is a testament to the good work that police officers do in protecting the public. When our children or our family are in danger, we do not hessitate to call for help, and we call the Police. Its about time people stopped complaining and started to give the Police some respect for the hard work and dedication that often requires them to put their lives on the line, to serve the public.",FALSE,FALSE,FALSE,FALSE,FALSE,FALSE,FALSE,FALSE,FALSE,FALSE,FALSE,FALSE
Ugg8FfTbbNF8IngCoAEC,04kJtp6pVXI,"The Arab dude is absolutely right, he should have not been shot 6 extra time. Shoot him once if hes attacking you and that would stop his attack. Shoot him twice if he's still attacking you, but six times? That is shoot to kill in my opinion. ",FALSE,FALSE,FALSE,FALSE,FALSE,FALSE,FALSE,FALSE,FALSE,FALSE,FALSE,FALSE
Ugg9a6FtoXdxmXgCoAEC,04kJtp6pVXI,here people his facebook is https://www.facebook.com/bassem.masri.520 he has ties with isis and other terrorist groups he is a muslim extremist ,TRUE,FALSE,FALSE,FALSE,FALSE,TRUE,FALSE,FALSE,FALSE,FALSE,TRUE,FALSE
Ugga9KzkNDGvlXgCoAEC,04kJtp6pVXI,"Check out this you tube post. ""Black man goes on an epic rant against Ferguson rioters.""

Although his message is delivered with childish, cartoon-ish emotions.... He is one of the very few African American's who gets it.",TRUE,FALSE,FALSE,FALSE,FALSE,TRUE,TRUE,FALSE,FALSE,FALSE,FALSE,FALSE
UggBlIXoph7p-3gCoAEC,04kJtp6pVXI,I would LOVE to see this pussy go to Staten Island and spit on a cop. I would LOVE to see it happen. Mike Brown was a strong arm thug and people are burning Ferguson down. Eric Garnier did nothing wrong and was choked to death. No protest on mafia controlled Staten Island. No burning cars. Nothing. ,TRUE,TRUE,FALSE,FALSE,TRUE,TRUE,TRUE,FALSE,FALSE,FALSE,FALSE,FALSE
UggD1aYSn7KOR3gCoAEC,04kJtp6pVXI,I agree with the protestor.,FALSE,FALSE,FALSE,FALSE,FALSE,FALSE,FALSE,FALSE,FALSE,FALSE,FALSE,FALSE
UggGm8a1fu8brngCoAEC,04kJtp6pVXI,mike browns father was made to say that boooshit,TRUE,TRUE,FALSE,FALSE,TRUE,FALSE,FALSE,FALSE,FALSE,FALSE,FALSE,FALSE
UggguNlx1Uu89HgCoAEC,04kJtp6pVXI,the guy on the right is so on point. don't judge on his speaking abilities but judge him on his messege! you racist fucks can suck my dick. and like always the media focusing on the thing that don't matter. CNN is shit.,TRUE,TRUE,FALSE,FALSE,TRUE,FALSE,FALSE,FALSE,FALSE,FALSE,FALSE,FALSE
UggHKcxZ-FvsJ3gCoAEC,04kJtp6pVXI,"moral of the story, don't reach for a cops gun because you're probably gunna get shot, white or black",FALSE,FALSE,FALSE,FALSE,FALSE,FALSE,FALSE,FALSE,FALSE,FALSE,FALSE,FALSE
UggLbJp619j8BHgCoAEC,04kJtp6pVXI,Masri is about as close as you can get to ISIS in America.  ,TRUE,TRUE,FALSE,FALSE,FALSE,FALSE,FALSE,FALSE,FALSE,FALSE,FALSE,FALSE
UggMY2Oggks5LngCoAEC,04kJtp6pVXI,We all know with the chimpers there is no compassion in their mud pumping hearts. ,TRUE,FALSE,FALSE,FALSE,FALSE,TRUE,TRUE,FALSE,FALSE,FALSE,FALSE,FALSE
UggNrFQh7L5JuXgCoAEC,04kJtp6pVXI,"""I can believe whatever I wanna believe, I don't care what any of them have to say.""
Bassem Masri, you are an idiot.",TRUE,TRUE,FALSE,FALSE,FALSE,FALSE,FALSE,FALSE,FALSE,FALSE,FALSE,FALSE
UggPT9Z38D5yt3gCoAEC,04kJtp6pVXI,Bassem Masri is a terrorist part of isis,TRUE,FALSE,FALSE,FALSE,FALSE,TRUE,FALSE,FALSE,FALSE,FALSE,TRUE,FALSE
UggRCZiMOIRLg3gCoAEC,04kJtp6pVXI,I would'nt waist my time trying to reason with this Police spitting Thug.  Trying to defend Criminal Brown is a losing matter.  The Grand Jury has made they're decision.   Live with it.,TRUE,TRUE,FALSE,TRUE,FALSE,FALSE,FALSE,FALSE,FALSE,FALSE,FALSE,FALSE
UggSYiWItbnmgngCoAEC,04kJtp6pVXI,"I wish mr masri was dead,,",TRUE,TRUE,FALSE,FALSE,FALSE,FALSE,FALSE,FALSE,FALSE,FALSE,FALSE,FALSE
Uggt6lvUxwS-7XgCoAEC,04kJtp6pVXI,"Thus, with a collapse of the USA, only two possibilities can be considered, whereby, with the one, it boils down to a dictatorship with evil reprisals, while the other possibility may be a new reconstruction, if people who are fundamentally conscious of their responsibilities attain government and really do everything to bring about an effective and valuable new start. But whether this will actually occur, is currently extremely questionable, because presently, in a totalitarian manner, everything is directed towards interests which are economic, military, political and cultural – as well as towards that which is strict fundamentalist religious-sectarian – and based on enormous lies and devious, misanthropic, criminal and felonious machinations in every imaginable regard. This also means that the population of the USA is spied upon by the secret services and even severely within the neighbourhoods, and so forth, and, in every possible manner being restricted in its freedom, and this is in addition to the violence, as it emerges in some form or other, both openly and covertly.﻿",FALSE,FALSE,FALSE,FALSE,FALSE,FALSE,FALSE,FALSE,FALSE,FALSE,FALSE,FALSE
Uggte-vb2ZLTQ3gCoAEC,04kJtp6pVXI,"You actually CAN shout ""fire"" in a crowded theater. Christopher Hitchens demonstrated this in his talk about ""free speech."" Look it up. The interviewee is correct. Cops serve the public, not the other way around. And it is consistent with serving that public that the police department represent that public's race and ethnicity in its ranks. Hire a bunch of big, tough, black guys to the police department and you will have fewer blacks being shot to death by a puny white guy who felt humiliated when he got bitch slapped by a teenager. ",TRUE,TRUE,FALSE,FALSE,TRUE,FALSE,FALSE,FALSE,FALSE,FALSE,FALSE,FALSE
UggtH27r-TTcZHgCoAEC,04kJtp6pVXI,"I think ,he kill him",TRUE,TRUE,FALSE,FALSE,FALSE,FALSE,FALSE,FALSE,FALSE,FALSE,FALSE,FALSE
UggtknH4gMWWfXgCoAEC,04kJtp6pVXI,LEGALIZE MARIJUANA! Then problems will stop,FALSE,FALSE,FALSE,FALSE,FALSE,FALSE,FALSE,FALSE,FALSE,FALSE,FALSE,FALSE
Ugg-ucO02B7XO3gCoAEC,04kJtp6pVXI,1 word: Provocateur........,FALSE,FALSE,FALSE,FALSE,FALSE,FALSE,FALSE,FALSE,FALSE,FALSE,FALSE,FALSE
UgguFITdgu455HgCoAEC,04kJtp6pVXI,Lol. This is what happens when the greedy rich slime keep the masses uneducated & ignorant. Now deal with the stupid that you created. Trying to reason with the irrational is an exercise in futility. Get the popcorn ready bc it's about to boil over. If you fall for the talk you will fall just walking. ,TRUE,TRUE,FALSE,FALSE,FALSE,FALSE,FALSE,FALSE,FALSE,FALSE,FALSE,FALSE
UggwBWh5il3cfXgCoAEC,04kJtp6pVXI,"The legal system is inherently racist, same as this CNN reporter",TRUE,TRUE,FALSE,FALSE,FALSE,FALSE,FALSE,FALSE,FALSE,FALSE,FALSE,FALSE
UggWg1MBoBR7x3gCoAEC,04kJtp6pVXI,He looks ready to cut heads off he must be a isis sympathizer and I'm going to say maybe 5% care about the issue at hand and other 95% just want to go loot stores and fuck shit up...,TRUE,FALSE,FALSE,FALSE,FALSE,TRUE,FALSE,FALSE,FALSE,FALSE,TRUE,FALSE
UggxCL2J1VOhLHgCoAEC,04kJtp6pVXI,"lol, ""shoot to apprehend"". He is an idiot.",TRUE,TRUE,FALSE,FALSE,FALSE,FALSE,FALSE,FALSE,FALSE,FALSE,FALSE,FALSE
UggY2U73L3toO3gCoAEC,04kJtp6pVXI,"This case has overshadowed the cops that murdered a kid with a fake sword in Saratoga Springs, Utah. I am just as much outraged by the Mike brown case. The murder that happened in Utah was just about the same deal. Cops are provided with non lethal weapons. The shooting in Utah unwarranted because he ran, don't know why he ran but if you lunged at the police with the fake sword you should have taken that opportunity for immediate action right then. He ran and was shot 6 times in the back. We know a large group of cops are corrupt and these murderers are nothing new. Though I have ran from the police many times when I was in my teens, cops just pursue and find him hiding some where. Not just put 6 bullets in the back ending a life. They said in some paper, Saratoga Springs has about 5% of black population.. I have been through there and I would say they were off by about 5%. ",FALSE,FALSE,FALSE,FALSE,FALSE,FALSE,FALSE,FALSE,FALSE,FALSE,FALSE,FALSE
Uggy6MHKQWnfo3gCoAEC,04kJtp6pVXI,This man is a zionist jew look at ypu can see the jewnesss in his face  cnn only employ zionist sympathisers and neo-con racists and wolf blitzer is the emplpyeee ,TRUE,FALSE,FALSE,FALSE,FALSE,TRUE,TRUE,FALSE,FALSE,FALSE,FALSE,FALSE
UggyCKjvUlfBYHgCoAEC,04kJtp6pVXI,"""There is blood on the street but you are worried about words"" .... we are ALL getting very tired with the way mainstream media is treating us like idiots who will follow their condescending, irrelevant, distracting, disparaging narrative... Step up CNN",FALSE,FALSE,FALSE,FALSE,FALSE,FALSE,FALSE,FALSE,FALSE,FALSE,FALSE,FALSE
UggYHsvinXkgM3gCoAEC,04kJtp6pVXI,"stop being criminals and you wont get shot, that simple",TRUE,TRUE,FALSE,TRUE,FALSE,FALSE,FALSE,FALSE,FALSE,FALSE,FALSE,FALSE
UggyJcZ89cWxUngCoAEC,04kJtp6pVXI,I LIKE TURTLES!,FALSE,FALSE,FALSE,FALSE,FALSE,FALSE,FALSE,FALSE,FALSE,FALSE,FALSE,FALSE
Ugh0tf8ZI_s6z3gCoAEC,04kJtp6pVXI,Massri needs an education.,TRUE,TRUE,FALSE,FALSE,FALSE,FALSE,FALSE,FALSE,FALSE,FALSE,FALSE,FALSE
Ugh1YgMkYS1iingCoAEC,04kJtp6pVXI,CNN mother fuckers....fuck you peace of shit!,TRUE,TRUE,FALSE,FALSE,TRUE,FALSE,FALSE,FALSE,FALSE,FALSE,FALSE,FALSE
Ugh4DQdAIl3qUXgCoAEC,04kJtp6pVXI,"Hers my statement, I think ali sheep butt fucker masri should take an ak and go fight in syria..",TRUE,TRUE,FALSE,TRUE,TRUE,TRUE,TRUE,FALSE,FALSE,FALSE,FALSE,FALSE
Ugh6foWeFvORtXgCoAEC,04kJtp6pVXI,Hahahahaha.  This guy is Ed Bassmaster's character ALWAYS TESTE. Ed Bassmaster has a semi-retarded character who is cross-eyed just like this guy,TRUE,TRUE,FALSE,FALSE,FALSE,FALSE,FALSE,FALSE,FALSE,FALSE,FALSE,FALSE
Ugh8Z3_R5r7iungCoAEC,04kJtp6pVXI,How do these childish cops sleep at night ?,FALSE,FALSE,FALSE,FALSE,FALSE,FALSE,FALSE,FALSE,FALSE,FALSE,FALSE,FALSE
UghANuDr-RLrqXgCoAEC,04kJtp6pVXI,A completely idiot having his minutrs of fame,TRUE,TRUE,FALSE,FALSE,FALSE,FALSE,FALSE,FALSE,FALSE,FALSE,FALSE,FALSE
UghBkatZ4WY1uXgCoAEC,04kJtp6pVXI,I hope to god you guys is still not falling for the same ol banana in the tailpipe bullshit news that they're giving you,TRUE,TRUE,FALSE,FALSE,FALSE,FALSE,FALSE,FALSE,FALSE,FALSE,FALSE,FALSE
UghBYihvgoUqcHgCoAEC,04kJtp6pVXI,CNN is such Bullcrap!,TRUE,TRUE,FALSE,FALSE,FALSE,FALSE,FALSE,FALSE,FALSE,FALSE,FALSE,FALSE
UghcKD-yV_JR5XgCoAEC,04kJtp6pVXI,"Alright. This entire case is crap. All of these people who are saying that white people are being racist, and calling them bad names is just as ""racist"", as you would like to call it, as us. There have been extensive investigations that prove that this boy's death was out of self defense. However, I am not defending the whole KKK thing. But, I am defending the helpless citizens of Ferguson. This boy died. I don't care if he was white or black. What I do care about is how the people in Ferguson are treating their town. If they really cared about this incident, they would hold memorials to express their feelings.This is not helping themselves get justice. What really matters is that this boy is dead. Something HAS been done about it. The Grand Jury has decided. Can it just be over?",FALSE,FALSE,FALSE,FALSE,FALSE,FALSE,FALSE,FALSE,FALSE,FALSE,FALSE,FALSE
UghcMPVXe6XJengCoAEC,04kJtp6pVXI,This guy doesn't know what happened he didn't have his hands up,FALSE,FALSE,FALSE,FALSE,FALSE,FALSE,FALSE,FALSE,FALSE,FALSE,FALSE,FALSE
UghCqsUPSUHkF3gCoAEC,04kJtp6pVXI,Ayy CNN are lookin like pussies ,TRUE,TRUE,FALSE,FALSE,TRUE,FALSE,FALSE,FALSE,FALSE,FALSE,FALSE,FALSE
UghEcCSj9amFtXgCoAEC,04kJtp6pVXI,Smirconnish is the most even-handed guy in the world.  This guy Masri is an idiot.,TRUE,TRUE,FALSE,FALSE,FALSE,FALSE,FALSE,FALSE,FALSE,FALSE,FALSE,FALSE
UgheEXayk90xIngCoAEC,04kJtp6pVXI,"Masri is a total idiot ""I don't have to know the evidence, I can just come to my own conclusions instead""
Here is a clue, dont attack a cop and try to take his gun and then rush him after he finally gets out of his car and you wont get shot duhhh.
So what would Masri do, take Brown out for a icecream as he is beating him into the ground and not defend himself?
BTW, Browns momma and gramma violently assaulted some people who were selling T-shirts in memory of Brown and put two people in the hospital, stole their money and trashed their shop and will probably be charged for it, so we all know what sort of mentality Brown was raised in and he was a thug wanna be, who caused his own death.",TRUE,TRUE,FALSE,FALSE,FALSE,TRUE,TRUE,FALSE,FALSE,FALSE,FALSE,FALSE
UghHgshwzX7053gCoAEC,04kJtp6pVXI,He had to take a break because Bassem was making too much sense for him to debate further. ,FALSE,FALSE,FALSE,FALSE,FALSE,FALSE,FALSE,FALSE,FALSE,FALSE,FALSE,FALSE
UghIBNvkzZh-xHgCoAEC,04kJtp6pVXI,"Let's reverse the rolls! Black racist cops in rich white communities.(but you can't prove there racist) When a white man gets pissed off at this intolerable condition. We unload several clips of high caliber ammo at point blank range for his audacity at questioning authority. All Americans need to be on full alert of this elitist agenda to set presidents of questioning authority. The elitist upper-class is the problem. Prison culture CIA drug Cartels. Exporting jobs and importing cheap labor, While the elitist get bailed out and support this corrupt system. We can turn this around when we c get past the race issue the Govt. incites to divide the working class, but you can hardly call it a working class because the Govt put everyone out of work. We are more of a homeless class. Let us not for get Western history and the role big money plays in this clusterfuck designed to destroy a Nation that is Destroyed at this point. We can get it back, ask me how.",TRUE,FALSE,FALSE,FALSE,FALSE,TRUE,TRUE,FALSE,FALSE,FALSE,FALSE,FALSE
UghICkPqoL9jJ3gCoAEC,04kJtp6pVXI,This moron is talking about being peaceful?  Their burning the nation's flag idiot.  Even though that's what you are suppose to do when it's old so they have no knowledge.  They are babies making noise. ,TRUE,TRUE,FALSE,FALSE,FALSE,FALSE,FALSE,FALSE,FALSE,FALSE,FALSE,FALSE
UghKXFnZ33ZOSXgCoAEC,04kJtp6pVXI," This is a CIA agent provocateur operative to kick-start the riots of the New American Civil War. He's not African American but his rehearsed ""Ebonics"" is transparent.",FALSE,FALSE,FALSE,FALSE,FALSE,FALSE,FALSE,FALSE,FALSE,FALSE,FALSE,FALSE
UghlkAzZr3_fI3gCoAEC,04kJtp6pVXI,Can someone shoot this black idiot too? That would make me giggle inside :),TRUE,TRUE,FALSE,TRUE,FALSE,TRUE,TRUE,FALSE,FALSE,FALSE,FALSE,FALSE
Ughm_dpizWFohHgCoAEC,04kJtp6pVXI,You people are sick! This man is speaking the truth and y'all are just mad. Trying to justify why a young boy who did nothing was shot and killed smh. Y'all are the devil and a disease to this earth! I'll be glad when the sun burns all your asses into extinction and we can have our planet back! Half animal half devil cave beasts!!! ,TRUE,TRUE,FALSE,TRUE,TRUE,FALSE,FALSE,FALSE,FALSE,FALSE,FALSE,FALSE
UghmRzgOUqMozXgCoAEC,04kJtp6pVXI,The world is changing im mad at the police too but id be dam if isis gonna come in here thats when its time to kill these faucks,TRUE,TRUE,TRUE,TRUE,FALSE,TRUE,FALSE,FALSE,FALSE,FALSE,TRUE,FALSE
Ughn17bxW7f5QXgCoAEC,04kJtp6pVXI,"CNN is propaganda for the most part, and people let them hear it in Ferguson too.",FALSE,FALSE,FALSE,FALSE,FALSE,FALSE,FALSE,FALSE,FALSE,FALSE,FALSE,FALSE
Ughnjn7WwwIgbHgCoAEC,04kJtp6pVXI,"What a waste of time talking to that idiot. ""You know what Im sayin."" ""I'll believe what I want to believe.""- Yup- hell with facts or evidence. Loser.",TRUE,TRUE,FALSE,FALSE,FALSE,FALSE,FALSE,FALSE,FALSE,FALSE,FALSE,FALSE
UghnzyBgv-jQ9ngCoAEC,04kJtp6pVXI,"News fucktards...........puppet players,,,,,all they are paid liars ",TRUE,TRUE,FALSE,FALSE,FALSE,FALSE,FALSE,FALSE,FALSE,FALSE,FALSE,FALSE
UghofW5VYVB8n3gCoAEC,04kJtp6pVXI,Bassem has the right to express himself....we have freedom of expression.....We all have that right....Its an amendment of the Constitution.....I dont think CNN is that competent after all.,FALSE,FALSE,FALSE,FALSE,FALSE,FALSE,FALSE,FALSE,FALSE,FALSE,FALSE,FALSE
UgholOxRzEdkW3gCoAEC,04kJtp6pVXI,"does this guy riot before or after work? Orrrr, let me guess he fucks off all day doing nothing.",TRUE,TRUE,FALSE,FALSE,FALSE,FALSE,FALSE,FALSE,FALSE,FALSE,FALSE,FALSE
UghOm2iqM9-AYngCoAEC,04kJtp6pVXI,Mr. Masri is 100% right couldn't say it any better myself.,FALSE,FALSE,FALSE,FALSE,FALSE,FALSE,FALSE,FALSE,FALSE,FALSE,FALSE,FALSE
UghOrBUXagc6J3gCoAEC,04kJtp6pVXI,Can anyone tell me why it is racist if a white man shoots a black man? Is it not racist when black man shoots a white man? Why do these cases turn instantly into racist ones it makes no sense.,FALSE,FALSE,FALSE,FALSE,FALSE,FALSE,FALSE,FALSE,FALSE,FALSE,FALSE,FALSE
UghP0v4pSXeRY3gCoAEC,04kJtp6pVXI,Racial profiling and police intimidation? He robbed a store and got killed as a result. Fucking excuses man. Black people shouldn't have to get arrested when they commit a strong arm robbery. When black people get violent they shouldn't have to fear getting put down like an animal. He actually said we shouldn't have to worry about warrants. lol. Fucking piece of human garbage.,TRUE,TRUE,FALSE,FALSE,FALSE,FALSE,FALSE,FALSE,FALSE,FALSE,FALSE,FALSE
UghPM1HvcyCWxHgCoAEC,04kJtp6pVXI,Wrong Mother Fucker. No shoot to apprehend,TRUE,TRUE,FALSE,FALSE,TRUE,FALSE,FALSE,FALSE,FALSE,FALSE,FALSE,FALSE
UghpqNHDIz3pMngCoAEC,04kJtp6pVXI,"Black and white crimes seems to be big topic in us after Ferguson case. I just came here to brag about Finnish cops that used firearm 6 times last year, 2 time towards human, 2 times to warn 2 times to kill wounded animal. 5 million ppl here and 0,5 gun per capita.",FALSE,FALSE,FALSE,FALSE,FALSE,FALSE,FALSE,FALSE,FALSE,FALSE,FALSE,FALSE
UghpY-GpHN0YpngCoAEC,04kJtp6pVXI,"and the heading reads, When the protesters take it too far",FALSE,FALSE,FALSE,FALSE,FALSE,FALSE,FALSE,FALSE,FALSE,FALSE,FALSE,FALSE
UghR9QQYvJx-RHgCoAEC,04kJtp6pVXI,This Muslim man does not have anything in mind of peace. He wants to stir up dissonance and trouble among Americans by using racist accusations . THAT IS HIS MAN GOAL.,TRUE,FALSE,FALSE,FALSE,FALSE,TRUE,FALSE,FALSE,FALSE,FALSE,TRUE,FALSE
UghRKLaioSvLOHgCoAEC,04kJtp6pVXI,"Add another imbecile to the bunch, reporter is a incompetent bastard",TRUE,TRUE,FALSE,FALSE,FALSE,FALSE,FALSE,FALSE,FALSE,FALSE,FALSE,FALSE
UghRygE9vO9A83gCoAEC,04kJtp6pVXI,This interviewer is right. This guy should show some respect to the paramilitary police that are killing and getting away with it. Ha!,TRUE,TRUE,FALSE,TRUE,FALSE,FALSE,FALSE,FALSE,FALSE,FALSE,FALSE,FALSE
Ughs3w350i3DvXgCoAEC,04kJtp6pVXI,You all are some dumb as people,TRUE,TRUE,FALSE,FALSE,FALSE,FALSE,FALSE,FALSE,FALSE,FALSE,FALSE,FALSE
UghTCrl4YYJ-qHgCoAEC,04kJtp6pVXI,bassem I think walmart is hiring for the holidays. get a job loser!!!,TRUE,TRUE,FALSE,FALSE,FALSE,FALSE,FALSE,FALSE,FALSE,FALSE,FALSE,FALSE
UghtQ_3FOmw6W3gCoAEC,04kJtp6pVXI,Teen faces life in prison for pot brownies. 90 year old man gets arrested for feeding the poor. Police officer is set free with no charges whatsoever for killing a teenager. Don't you people see how wrong this is? ,FALSE,FALSE,FALSE,FALSE,FALSE,FALSE,FALSE,FALSE,FALSE,FALSE,FALSE,FALSE
UghTxr-iist_7ngCoAEC,04kJtp6pVXI,"""you know what I'm sayin""... wow",FALSE,FALSE,FALSE,FALSE,FALSE,FALSE,FALSE,FALSE,FALSE,FALSE,FALSE,FALSE
UghVbr3QCu8ckngCoAEC,04kJtp6pVXI,"YEah  You are right 1 white shot a  black all hell break  lose , black shot black no protest maybe if they start doing  protest on black shotting black , you can buy in thier story ,",TRUE,FALSE,FALSE,FALSE,FALSE,TRUE,TRUE,FALSE,FALSE,FALSE,FALSE,FALSE
UghVVDZrCYMG_3gCoAEC,04kJtp6pVXI,"Lets Steal from a convenience store then lets go and punch a cop in the face and get shot 6 times, then lets get all the black people and white apologists to run around the street setting buildings on fire, fucking dirty gutter rats all living on welfare and causing violence , just look where the rest of black people live... on the dirties Ebola plague ridden continent, lucky white countries can come over and cure their dumb asses.",TRUE,FALSE,FALSE,FALSE,FALSE,TRUE,TRUE,FALSE,FALSE,FALSE,FALSE,FALSE
UghvxEUB679Ug3gCoAEC,04kJtp6pVXI,I'm with this dude fuck the punk police ,TRUE,TRUE,FALSE,FALSE,TRUE,FALSE,FALSE,FALSE,FALSE,FALSE,FALSE,FALSE
UghWdXOwEJc0eHgCoAEC,04kJtp6pVXI,What a stupid arab. Police shoot to apprehend? Lmao That's not how it works when they are being attacked!,TRUE,FALSE,FALSE,FALSE,FALSE,TRUE,TRUE,FALSE,FALSE,FALSE,FALSE,FALSE
UghWm5GCsm7byXgCoAEC,04kJtp6pVXI,5:09 plain n simple truth,FALSE,FALSE,FALSE,FALSE,FALSE,FALSE,FALSE,FALSE,FALSE,FALSE,FALSE,FALSE
UghY8Jytv5XqC3gCoAEC,04kJtp6pVXI,Lmfao why is this dude taking like that??? -_\ I hear him talking but I don't know what he's saying!  Smh,FALSE,FALSE,FALSE,FALSE,FALSE,FALSE,FALSE,FALSE,FALSE,FALSE,FALSE,FALSE
UghyTs2sJC_jSXgCoAEC,04kJtp6pVXI,"I do understand their anger, but war is not the answer!",FALSE,FALSE,FALSE,FALSE,FALSE,FALSE,FALSE,FALSE,FALSE,FALSE,FALSE,FALSE
Ughzp24D_j0sw3gCoAEC,04kJtp6pVXI,Iz didn't do nuffinz!,FALSE,FALSE,FALSE,FALSE,FALSE,FALSE,FALSE,FALSE,FALSE,FALSE,FALSE,FALSE
Ugi0Cfb82xGsongCoAEC,04kJtp6pVXI,"What an ignorant coward, full of emotion, estrogen and apathy. And where the hell did you come from? Fuckin racially ambiguous blackwashed loudmouth. They really chose a pathetic man to interview. ",TRUE,TRUE,FALSE,TRUE,FALSE,TRUE,TRUE,FALSE,FALSE,FALSE,FALSE,FALSE
Ugi1CjkwLYHcvHgCoAEC,04kJtp6pVXI,"That motherfucker was angry,and I understand why",TRUE,TRUE,FALSE,FALSE,TRUE,FALSE,FALSE,FALSE,FALSE,FALSE,FALSE,FALSE
Ugi2H0FCe-_y4ngCoAEC,04kJtp6pVXI,Let's get this straight and present the facts as the mass media should have from the beginning. 18 yr old (by all legal aspects an adult) robs a convince store. The criminal later flees the seen and is aprehended by the police. Resists arrest and altercation occurs between the two. The police (as in every case similar to this uses force). Criminal is killed. The killing goes to court. A randomly selected jury views all the evidence and hears out all witnesses which pertain to the case.  Radom jury reaches unanimous verdict of not guilty. Im sorry protestors I can't here over all this DEMOCRACY!,TRUE,TRUE,FALSE,TRUE,FALSE,FALSE,FALSE,FALSE,FALSE,FALSE,FALSE,FALSE
Ugi3AdgMRYrQUHgCoAEC,04kJtp6pVXI,Do any of these protestors work for a living??  where do they get the (time) to do all this....,FALSE,FALSE,FALSE,FALSE,FALSE,FALSE,FALSE,FALSE,FALSE,FALSE,FALSE,FALSE
Ugi8SNusKxJjQXgCoAEC,04kJtp6pVXI,"If people would obey the law, like normal human beings. This would never happen. <- WINNER",FALSE,FALSE,FALSE,FALSE,FALSE,FALSE,FALSE,FALSE,FALSE,FALSE,FALSE,FALSE
UgiBmDegoK7fvHgCoAEC,04kJtp6pVXI,No indictment...moving right along.,FALSE,FALSE,FALSE,FALSE,FALSE,FALSE,FALSE,FALSE,FALSE,FALSE,FALSE,FALSE
UgiBZnwqmnNYUXgCoAEC,04kJtp6pVXI,If you act like animals you get treated like animals,TRUE,FALSE,FALSE,FALSE,FALSE,TRUE,TRUE,FALSE,FALSE,FALSE,FALSE,FALSE
