IsToxic,IsToxic,IsToxic,IsToxic,IsAbusive,IsThreat,IsProvocative,IsObscene,IsHatespeech,IsRacist,IsNationalist,IsSexist,IsHomophobic,IsReligiousHate,IsRadicalism
Ugif7J_LQBVe_HgCoAEC,04kJtp6pVXI, Michael Smerconish + Hack. ,FALSE,FALSE,FALSE,FALSE,FALSE,FALSE,FALSE,FALSE,FALSE,FALSE,FALSE,FALSE
Ugi-hbdDmIuKVHgCoAEC,04kJtp6pVXI,"Sure...they totally looked at FACTUAL evidence during that trial...

More like special treatment. BUT HEY, we all knew that was going to happen, didn't we?",TRUE,TRUE,FALSE,TRUE,FALSE,FALSE,FALSE,FALSE,FALSE,FALSE,FALSE,FALSE
Ugi-HtibDw0eongCoAEC,04kJtp6pVXI,You tellin me if he did in fact steal swisher sweets is the value of his life...Just admit you all are racist quit being a bunch of FAGGOTT bitches ,TRUE,TRUE,FALSE,FALSE,FALSE,FALSE,FALSE,FALSE,FALSE,FALSE,FALSE,FALSE
UgiIASdSnR-gi3gCoAEC,04kJtp6pVXI,"Proof Blacks aren't victims:
1. Statistically Cops kill more whites than blacks, yet whites see them as necessary because they save more lives than they cost, while places like Ferguson lose their minds.
2. Statistically 93% of murdered blacks are killed by other blacks, with whites consisting of 3% of the murderers and 4% being the other races.
3. Whites were enslaved by blacks first, and for over 150 years. This was when Europeans(the same race that started America and later enslaved Africans) began searching North Africa to establish trade of goods between natives. From the 1520s to the late 1600s whites were enslaved first. Later the tables turned. This boys and girls is called 'Karma.'
4. Statistically over 50% of murders in the US alone are from Blacks, despite them making up only 14.1% of the entire US population, while despite whites make up 63% of the US population they only make up 46% of the murders.
5. Whites make up 38% of welfare recipients with blacks making up 39%. This doesn't seem extreme until you realize that 39%(blacks) consists of that 14.1%, whith that 38%(whites) making up 63% of the US. Meaning each individual black person is about 5 times as likely than whites to use welfare.",TRUE,FALSE,FALSE,FALSE,FALSE,TRUE,TRUE,FALSE,FALSE,FALSE,FALSE,FALSE
UgiId66Fu7KrDXgCoAEC,04kJtp6pVXI,"White man can't finish his sentence
America needs to wake up!!the truth of murder is there!",TRUE,TRUE,FALSE,FALSE,FALSE,TRUE,TRUE,FALSE,FALSE,FALSE,FALSE,FALSE
UgiifTZEiDlZJ3gCoAEC,04kJtp6pVXI,I'll be sure to avoid getting in this guy's taxi cab.,FALSE,FALSE,FALSE,FALSE,FALSE,FALSE,FALSE,FALSE,FALSE,FALSE,FALSE,FALSE
UgiiIyWpe1-9H3gCoAEC,04kJtp6pVXI,"FUCK MEDIA 
Bassem was right find something real to investigate. You're just exaggerating because you want more views and more MONEY.

FUCK YOU SELFISH FUCKS

These people are DISGUSTING. I don't know how they bare with their NASTY selves.",TRUE,TRUE,FALSE,TRUE,TRUE,FALSE,FALSE,FALSE,FALSE,FALSE,FALSE,FALSE
UgijB5AT7Ka-rngCoAEC,04kJtp6pVXI,CNN youse guys going too far I'll tell you what you doing so that bad is going to happen very bad it's all going to benefit you I don't care how much money you have Ellen and better for you to be like all the rest was be careful what you put out there you put Russia in between this be careful we have kids,FALSE,FALSE,FALSE,FALSE,FALSE,FALSE,FALSE,FALSE,FALSE,FALSE,FALSE,FALSE
UgiKFJ8QuPBoQXgCoAEC,04kJtp6pVXI,this guy here he needs to grow up.,FALSE,FALSE,FALSE,FALSE,FALSE,FALSE,FALSE,FALSE,FALSE,FALSE,FALSE,FALSE
UgiLaetJkobicXgCoAEC,04kJtp6pVXI,"Shoot to apprehend? Easier said than done.. When the evidence was presented, Michael brown was still attackin darren after he was shot twice.... People have this misconception, like in the movies, that one gun shot anywhere to the body, will disable an attacker. This is a false belief.. There are cases of people still attacking or running after they've been shot 2-3 times. For god sake, 50 cent was shot 9 times and he's alive... When you're being attacked by a 6 ft 3 200 somthing pound person, and you're on your back, it's hard to say I""m just goin to shoot to apprehend. Had michael brown copnducted himself like a gentleman, this wouldn't have happened. He was an aggresive piece of shit, and this muslim shit head isn't any better. He's filled with rage and doesn't have the answer for anything. Progression comes from tolerance not violence.",TRUE,FALSE,FALSE,FALSE,FALSE,TRUE,TRUE,FALSE,FALSE,FALSE,TRUE,FALSE
UgilC8NhlKosBXgCoAEC,04kJtp6pVXI,"It's not about just Brown, it's about daily killings of non-whites by white cops and that's a reality.",FALSE,FALSE,FALSE,FALSE,FALSE,FALSE,FALSE,FALSE,FALSE,FALSE,FALSE,FALSE
UgilJs0s4YO3engCoAEC,04kJtp6pVXI,"How was this guy hired?
What an idiot",TRUE,TRUE,FALSE,FALSE,FALSE,FALSE,FALSE,FALSE,FALSE,FALSE,FALSE,FALSE
UgilNUPOY8iZqHgCoAEC,04kJtp6pVXI,This guy is a moron.,TRUE,TRUE,FALSE,FALSE,FALSE,FALSE,FALSE,FALSE,FALSE,FALSE,FALSE,FALSE
UgiLP4HQY3jn8ngCoAEC,04kJtp6pVXI,Cnn...so out of touch..close up idiots.. people are watching for the comedy of reporting.lol,TRUE,TRUE,FALSE,FALSE,FALSE,FALSE,FALSE,FALSE,FALSE,FALSE,FALSE,FALSE
UgilQ0CFxc2R2ngCoAEC,04kJtp6pVXI,"Bassem Masri is a criminal, a thug and a psychopath. He has no credibility, and no humanity. He needs to be locked in a jail cell. Time for the rubber-room and straight-jacket for Bassem. Get his intellectually dishonest butt out of the community. ",TRUE,TRUE,FALSE,FALSE,TRUE,FALSE,FALSE,FALSE,FALSE,FALSE,FALSE,FALSE
